"keywords","_col1"
"adidas running shoes men","3"
"nike running shoes men","3"
"soles for shoes men","3"
"mens boat shoes size 10 kickers","3"
"black shoes men","3"
"running shoes mens","3"
"mtb flat shoes mens","3"
"levi shoes men","3"
"skechers golf shoes mens uk 10","3"
"sefti shoes men","3"
"seifty shoes men","3"
"seifty shoes men dewalt","3"
"waterproof walking shoes for men","3"
"geox boys school shoes suze 3","3"
"mod shoes men","3"
"men s shoes nike","3"
"reebok shoes men","3"
"nike running shoes mens","3"
"silver dance shoes mens","3"
"adidas waterproof running shoes men","3"
"school shoes boys","3"
"climbing shoes mens","3"
"dune shoes men","3"
"school shoes boys","3"
"school shoes boys size 10 adult","3"
"inov 8 trail shoes for men","3"
"salomon shoes men","3"
"salomon shoes men","3"
"salomon shoes men speedcross 5","3"
"mens navy blue shoes mod","3"
"mens running shoes t529q made in vietnam","3"
"work shoes men","3"
"karrimor walking shoes men's","3"
"cruyff shoes men","3"
"school shoes boys","3"
"wellington shoes men","3"
"asics running shoes men","3"
"smart work shoes men","3"
"merrell walking shoes men size 7","3"
"light up shoes boys","3"
"la coste shoes men","3"
"la coste shoes men 12.5","3"
"ecco shoes men","3"
"winter shoes mens","3"
"lounge shoes men","3"
"mens skater shoes size 10 uk","3"
"boys shoes size 8","3"
"running shoes mens","3"
"running shoes mens","3"
"baby shoes 12-18 months boys","3"
"golf shoes mens uk","3"
"boys winter shoes ecco","3"
"waterproof mens shoes adidas","3"
"mens walking shoes black","3"
"nike running shoes mens","3"
"meindl walking shoes men","3"
"meindl walking shoes men gotetex","3"
"meindl walking shoes men 10","3"
"running shoes mens","3"
"nike running shoes mens","3"
"mens welly shoes wide fit","3"
"running shoes mens","3"
"running shoes mens new balance","3"
"school shoes size 8 mens","3"
"asics running shoes men","3"
"running shoes mens","3"
"chef safety shoes men","3"
"laces for men shoes blue","3"
"gardening shoes men size 10","3"
"mens golf shoes callaway","3"
"mens golf shoes callaway cheviot mens","3"
"on running shoes mens","3"
"asics running shoes men","3"
"merrell leather shoes for men","3"
"mens skate shoes size 12","3"
"karrimor walking shoes men's","3"
"karrimor wide fit walking shoes men's","3"
"ecco shoes men","3"
"timberland shoes mens","3"
"ted baker shoes men","3"
"baby prewalker shoes boy","3"
"mens walking shoes size 11","3"
"nike running shoes mens","3"
"winter shoes boys","3"
"winter shoes boys size 8","3"
"running shoes mens","3"
"roller shoes for boys","3"
"mens slip on shoes black","3"
"dolce gabbana shoes mens","3"
"work shoes men","3"
"platform shoes men","3"
"platform shoes men 70s","3"
"asics running shoes men","3"
"wheeled shoes for boys","3"
"running shoes men 9.5","3"
"running shoes men 9.5 red","3"
"skechers safety shoes men","3"
"occasion white shoes for baby boys","3"
"occasion whitebaby boy size 7 white shoe shoes for baby boys","3"
"occasion whitebabsize 7 childs white shoe boy size 7 white shoe shoes for baby boys","3"
